{
  "$schema": "http://json-schema.org/draft-07/schema#",
  "$id": "https://aer.sequence.org/schemas/v1/MarketOrder.schema.json",
  "title": "AER Serverless P2P Market Order Schema",
  "description": "Cryptographically signed order manifest for decentralized P2P trading of GPU compute, proprietary MCP tools, and domain datasets (AER Appendix B).",
  "type": "object",
  "required": [
    "schema_version",
    "order_id",
    "side",
    "resource_type",
    "resource_specification",
    "resource_cid",
    "quantity",
    "price_credit_b",
    "total_price_credit_b",
    "maker_node_id",
    "expiration_timestamp",
    "nonce",
    "maker_signature"
  ],
  "additionalProperties": false,
  "properties": {
    "schema_version": {
      "type": "string",
      "pattern": "^1\\.[0-9]+\\.[0-9]+$",
      "description": "Semantic version of the schema specification (e.g. 1.0.0)."
    },
    "order_id": {
      "type": "string",
      "pattern": "^0x[a-fA-F0-9]{64}$",
      "description": "Unique 32-byte hash identifying this trade order manifest."
    },
    "side": {
      "type": "string",
      "enum": ["BID", "ASK"],
      "description": "Order direction: BID (buyer offering Credit B) or ASK (seller offering resource)."
    },
    "resource_type": {
      "type": "string",
      "enum": [
        "GPU_QUOTA",
        "MCP_TOOL",
        "DATASET",
        "BANDWIDTH_TUNNEL"
      ],
      "description": "Category of computational, algorithmic, or informational asset being exchanged."
    },
    "resource_specification": {
      "type": "object",
      "additionalProperties": true,
      "description": "Structured metadata describing hardware capability, tool interface, or dataset schema."
    },
    "resource_cid": {
      "type": "string",
      "minLength": 10,
      "maxLength": 128,
      "description": "Content Identifier (IPFS CIDv1, Swarm hash, or SHA-256 URI) pointing to the encrypted payload or OpenAPI/MCP spec."
    },
    "quantity": {
      "type": "number",
      "exclusiveMinimum": 0.0,
      "description": "Numeric volume of units (e.g. GPU-hours, API call credits, dataset chunks)."
    },
    "price_credit_b": {
      "type": "string",
      "pattern": "^[0-9]+$",
      "description": "Price per single unit denominated in atomic Credit B units."
    },
    "total_price_credit_b": {
      "type": "string",
      "pattern": "^[1-9][0-9]*$",
      "description": "Total consideration in atomic Credit B units (quantity * price_credit_b)."
    },
    "maker_node_id": {
      "type": "string",
      "pattern": "^0x[a-fA-F0-9]{40}$",
      "description": "Ethereum address of the order creator broadcasting into GossipSub."
    },
    "expiration_timestamp": {
      "type": "integer",
      "minimum": 1700000000,
      "description": "Unix timestamp after which this order expires and becomes void."
    },
    "nonce": {
      "type": "integer",
      "minimum": 0,
      "description": "Maker sequence counter to prevent order replay."
    },
    "maker_signature": {
      "type": "string",
      "pattern": "^0x[a-fA-F0-9]{130}$",
      "description": "65-byte ECDSA signature generated by the maker over the order payload."
    }
  }
}
